{
  "pass": false,
  "risk_level": "medium",
  "summary": "Replace this with a short review conclusion.",
  "checks": {
    "contract_aligned": false,
    "scope_respected": false,
    "tests_verified": false,
    "artifact_drift": false
  },
  "findings": [
    {
      "type": "logic",
      "severity": "medium",
      "file": "src/example.ts",
      "line": 1,
      "description": "Replace this with a real finding."
    }
  ],
  "required_actions": [
    "Replace this with the concrete next action."
  ],
  "manual_review_required": true
}
